{
  "request_id": "ar_01929f1a-6c2e-7b3c-9e4d-00000000001a",
  "nonce_b64": "nj8VYyTULw6ktvT86B1W+w==",
  "session_key": "claude_code:7f1e2d3c-4b5a-4c6d-8e7f-0a1b2c3d4e5f",
  "agent_kind": "claude_code",
  "agent_label": "Claude Code",
  "project": {
    "project_key": "c:/dev/agentnest",
    "name": "agentnest",
    "path_hint": "…\\dev\\agentnest",
    "repo": "owner/agentnest",
    "branch": "feat/pairing"
  },
  "origin": "claude_code.hook.http",
  "created_at": "2026-10-15T12:35:00.000Z",
  "expires_at": "2026-10-15T12:37:00.000Z",
  "ttl_seconds": 120,
  "tool_name": "Bash",
  "title": "명령을 실행하려고 해요",
  "purpose": "node_modules 폴더를 지우고 다시 설치합니다.",
  "details": {
    "kind": "command",
    "command": "rm -rf node_modules && pnpm install",
    "cwd_hint": "…\\apps\\desktop",
    "file_paths": [
      "desktop/apps/desktop/node_modules"
    ],
    "truncated": false,
    "permission_suggestions_count": 1
  },
  "tool_input_sha256": "940519b4cf559666e1068256e714a63ef4b8df29e78fc02b9b75079bbeae4032",
  "risk": {
    "level": "high",
    "reasons": [
      "recursive_delete"
    ],
    "reasons_ko": [
      "폴더를 통째로 지우는 명령이에요"
    ],
    "extra_confirmation": "hold"
  },
  "allowed_decisions": [
    "allow",
    "deny",
    "deny_and_stop"
  ],
  "auth_required_for": [
    "allow",
    "deny_and_stop"
  ],
  "permission_mode": "default",
  "local_prompt": "unknown"
}
